{
  "private": {
    "controlRoot": "[SCOPA_CONTROL_ROOT]",
    "raw": "[SCOPA_RAW_STREAM_REDACTED]",
    "repositoryRoot": "[SCOPA_REPOSITORY_ROOT]",
    "stderr": "[SCOPA_STDERR_REDACTED]",
    "stdout": "[SCOPA_STDOUT_REDACTED]"
  },
  "publicationReceipt": {
    "redactions": [
      {
        "field": "/private/controlRoot",
        "occurrences": 1,
        "replacement": "[SCOPA_CONTROL_ROOT]"
      },
      {
        "field": "/private/raw",
        "occurrences": 1,
        "replacement": "[SCOPA_RAW_STREAM_REDACTED]"
      },
      {
        "field": "/private/repositoryRoot",
        "occurrences": 1,
        "replacement": "[SCOPA_REPOSITORY_ROOT]"
      },
      {
        "field": "/private/stderr",
        "occurrences": 1,
        "replacement": "[SCOPA_STDERR_REDACTED]"
      },
      {
        "field": "/private/stdout",
        "occurrences": 1,
        "replacement": "[SCOPA_STDOUT_REDACTED]"
      }
    ],
    "schema": "scopa.live-evidence-publication-receipt.v1",
    "semanticFieldsChanged": false,
    "sourceSha256": "46552cb0489ba887f269d274bbd5496ee90693392f1d69ec244b484dad6c1c3a"
  },
  "receipt": {
    "artifact": {
      "package": {
        "integrity": "sha512-fcdb5CGGbJYJnMIFtSij9DUV1TotN0w72jGtyBQ0KjkwZzX0DPQIi7NbU2FMJmjfQhx5gtmXK82rdSPwwanXfw==",
        "name": "@heart-ai-foundation/scopa",
        "sha256": "a3903d7fe50b384e8b1f05eba9a978d8d2c9fcd87142f8dcc149ba13197171e9",
        "version": "0.2.0-dev.1"
      },
      "schema": "scopa.installed-artifact-identity.v1",
      "sourceCommit": "6235d647badd8fa136ce77214ce9c38d2fd80b6b"
    },
    "capabilityMatrix": {
      "schema": "scopa.capability-matrix.v1",
      "sha256": "260d4257098a4be5a1d9c71c2effec6c163b8b60aba2ed068c42c65d179f0793"
    },
    "client": {
      "expectedVersion": "2.1.220",
      "name": "claude-code",
      "observedVersion": "2.1.220"
    },
    "environmentPolicy": {
      "inheritance": "explicit-allowlist",
      "inheritedNameCount": 6,
      "inheritedNamesSha256": "46d8d09ed24a5071525f313b979ae7c21638143053bd56a2c9860486d113182f",
      "policySha256": "621f80fedc323eddba5266b602aae4fcec6e7e01646ddd6b64fb607dd9aca020",
      "removedNames": [
        "ANTHROPIC_API_KEY",
        "ANTHROPIC_AUTH_TOKEN",
        "ANTHROPIC_BASE_URL",
        "CLAUDE_CODE_USE_BEDROCK",
        "CLAUDE_CODE_USE_FOUNDRY",
        "CLAUDE_CODE_USE_VERTEX",
        "CLAUDE_CONFIG_DIR",
        "NODE_OPTIONS"
      ],
      "schema": "scopa.live-environment-policy.v1",
      "setNames": [
        "DISABLE_AUTOUPDATER"
      ],
      "setValuesSha256": "e3ca76a111a3cfb1835c0f2e6799cbd6888c37507cbdd3bf097ab26d95330978"
    },
    "invocation": {
      "argumentCount": 34,
      "argumentsSha256": "321c21b5e7ac1682e28d998ea58afc578384dcda148d74ed4b97f48e056ec48a",
      "commandName": "claude",
      "stdinSha256": "3d3620221b1368b18795fb0166feb88167ee5395dd7d6993038b760e1e86b4d0"
    },
    "limits": {
      "cleanupWaitMs": 1000,
      "inputSettleMs": 1000,
      "livePolicySha256": "8c4816cf90735aa7513135f2dea07c13c6c3df6c974ce62ada4f33f4ba21e687",
      "maxBudgetUsd": "0.20",
      "maxCampaignBudgetUsd": "0.40",
      "maxCaptureBytes": 20971520,
      "maxPrivateEvidenceBytes": 26214400,
      "maxProviderInvocations": 2,
      "maxTurns": 12,
      "terminateGraceMs": 500,
      "timeoutMs": 120000
    },
    "profile": {
      "name": "claude-code-headless-v1",
      "sha256": "74a6b5a69b5b8f76a7b7645ff8e8911149bb6d0824042ef29a89cb8563e22aa8"
    },
    "requestedModel": "sonnet",
    "scenario": {
      "id": "denied",
      "version": "S15R2.v1"
    },
    "schema": "scopa.live-receipt.v1"
  },
  "schema": "scopa.live-evidence.public.v1",
  "summary": {
    "costUsd": "0.0565726",
    "expectedCanStop": true,
    "livePolicySha256": "8c4816cf90735aa7513135f2dea07c13c6c3df6c974ce62ada4f33f4ba21e687",
    "modelCallableToolsScopaOnly": true,
    "observedCanStop": true,
    "observedClientVersion": "2.1.220",
    "observedModel": "claude-sonnet-5",
    "orphanDetected": false,
    "processGroupGone": true,
    "providerResidue": {
      "changedFileCount": 0,
      "files": [],
      "onlyBoundedNonResumableMetadata": true,
      "totalChangedBytes": 0
    },
    "requestedModel": "sonnet",
    "scenario": "denied",
    "scenarioVersion": "S15R2.v1",
    "schema": "scopa.claude-live-run-summary.v1",
    "turns": 7
  },
  "terminal": {
    "canStop": true,
    "cleanup": {
      "groupGone": true,
      "killSent": false,
      "method": "posix-process-group",
      "orphanDetected": false,
      "termSent": false
    },
    "exitCode": 0,
    "ok": true,
    "output": {
      "capturedBytes": 53279,
      "maxBytes": 20971520,
      "stderrBytes": 0,
      "stderrSha256": "e3b0c44298fc1c149afbf4c8996fb92427ae41e4649b934ca495991b7852b855",
      "stdoutBytes": 53279,
      "stdoutSha256": "4b03d58041d90855e529c2ddb05297c89121c358d3144c6bc4bd873cf8cc0cc0",
      "truncated": false
    },
    "reason": "completed",
    "schema": "scopa.live-terminal.v1",
    "signal": null,
    "state": "succeeded"
  }
}
